{
  "version": 1,
  "ignored_gates": [],
  "default_gate_review_agents": [
    "code-reviewer"
  ],
  "change_intake": {
    "keywords": [
      "implement",
      "create",
      "new feature",
      "new service",
      "add feature",
      "build",
      "change",
      "update",
      "modify",
      "refactor",
      "fix",
      "repair",
      "remove",
      "delete",
      "migrate",
      "introduce",
      "enhance",
      "extend",
      "replace",
      "upgrade",
      "rework",
      "refine",
      "refinement"
    ],
    "agents": [
      "product-intent-agent",
      "requirements-agent"
    ],
    "quality_gates": [
      "G1",
      "G2"
    ]
  },
  "routes": [
    {
      "id": "product-intent",
      "workflow_shape": "unclassified",
      "paths": [
        "product/intent/**",
        "docs/product-intent/**"
      ],
      "keywords": [
        "product intent",
        "mission objective",
        "intent capture"
      ],
      "primary": [
        "product-intent-agent"
      ],
      "support": [
        "requirements-agent"
      ],
      "quality_gates": [
        "G1"
      ]
    },
    {
      "id": "requirements-baseline",
      "workflow_shape": "unclassified",
      "paths": [
        "product/requirements/**",
        "docs/requirements-baseline/**"
      ],
      "keywords": [
        "requirements decomposition",
        "requirements traceability",
        "test obligations"
      ],
      "primary": [
        "requirements-agent"
      ],
      "reviewers": [
        "test-engineer"
      ],
      "quality_gates": [
        "G1",
        "G2"
      ]
    },
    {
      "id": "delivery-sequencing",
      "workflow_shape": "unclassified",
      "paths": [],
      "keywords": [
        "dependency map",
        "dependency mapping",
        "critical path",
        "sequencing",
        "sequence the work",
        "delivery order",
        "what blocks what"
      ],
      "primary": [
        "delivery-sequencer"
      ],
      "support": [
        "assumption-register",
        "cost-capacity-planner"
      ]
    },
    {
      "id": "premortem",
      "workflow_shape": "unclassified",
      "paths": [],
      "keywords": [
        "premortem",
        "pre-mortem",
        "assume this failed"
      ],
      "primary": [
        "premortem"
      ]
    },
    {
      "id": "assumption-register",
      "workflow_shape": "unclassified",
      "paths": [],
      "keywords": [
        "assumption register",
        "record an assumption",
        "track assumptions"
      ],
      "primary": [
        "assumption-register"
      ]
    },
    {
      "id": "scope-boundary-check",
      "workflow_shape": "unclassified",
      "paths": [],
      "keywords": [
        "scope boundary check",
        "build boundary",
        "future-state capability",
        "in scope or out of scope"
      ],
      "primary": [
        "scope-boundary"
      ]
    },
    {
      "id": "approval-routing",
      "workflow_shape": "unclassified",
      "paths": [],
      "keywords": [
        "approval routing",
        "who must approve",
        "authority matrix lookup"
      ],
      "primary": [
        "approval-router"
      ]
    },
    {
      "id": "halt-determination",
      "workflow_shape": "unclassified",
      "paths": [],
      "keywords": [
        "halt determination",
        "stop the line",
        "emergency stop",
        "system halt"
      ],
      "primary": [
        "halt-authority"
      ]
    },
    {
      "id": "doctrine-conformance-check",
      "workflow_shape": "unclassified",
      "paths": [],
      "keywords": [
        "doctrine conformance",
        "doctrinal language",
        "doctrine check"
      ],
      "primary": [
        "doctrine-conformance"
      ]
    },
    {
      "id": "architecture-authority-review",
      "workflow_shape": "unclassified",
      "paths": [],
      "keywords": [
        "abstraction layer",
        "infrastructure boundary violation",
        "architecture authority review"
      ],
      "primary": [
        "architecture-authority"
      ]
    },
    {
      "id": "phase-gate-check",
      "workflow_shape": "unclassified",
      "paths": [],
      "keywords": [
        "phase gate",
        "phase exit criteria",
        "phase transition"
      ],
      "primary": [
        "phase-gate"
      ],
      "reviewers": [
        "compliance-reviewer"
      ]
    },
    {
      "id": "first-principles-challenge",
      "workflow_shape": "unclassified",
      "paths": [],
      "keywords": [
        "first principles challenge",
        "first-principles challenge",
        "challenge this constraint"
      ],
      "primary": [
        "first-principles-challenger"
      ]
    },
    {
      "id": "subtraction-review",
      "workflow_shape": "unclassified",
      "paths": [],
      "keywords": [
        "subtraction review",
        "what comes out",
        "argue for removal"
      ],
      "primary": [
        "subtraction-agent"
      ]
    },
    {
      "id": "falsification-test",
      "workflow_shape": "unclassified",
      "paths": [],
      "keywords": [
        "falsification test",
        "disproving test",
        "falsify this claim"
      ],
      "primary": [
        "falsification-agent"
      ]
    },
    {
      "id": "red-team-assessment",
      "workflow_shape": "unclassified",
      "paths": [],
      "keywords": [
        "red team assessment",
        "red team",
        "adversarial assessment"
      ],
      "primary": [
        "red-team"
      ],
      "reviewers": [
        "security-reviewer"
      ]
    },
    {
      "id": "deployment-realism-review",
      "workflow_shape": "unclassified",
      "paths": [],
      "keywords": [
        "deployment realism",
        "operate this at scale",
        "pilot readiness review"
      ],
      "primary": [
        "deployment-realist"
      ]
    },
    {
      "id": "classification-and-marking",
      "workflow_shape": "unclassified",
      "paths": [],
      "keywords": [
        "classification and marking",
        "data classification gate",
        "artifact leaving the environment"
      ],
      "primary": [
        "classification-and-marking-gate"
      ]
    },
    {
      "id": "claim-conformance-check",
      "workflow_shape": "unclassified",
      "paths": [],
      "keywords": [
        "claim conformance",
        "external claim review",
        "floor script review"
      ],
      "primary": [
        "claim-conformance"
      ],
      "reviewers": [
        "compliance-reviewer"
      ]
    },
    {
      "id": "vendor-register-review",
      "workflow_shape": "unclassified",
      "paths": [],
      "keywords": [
        "vendor register",
        "tooling register",
        "vendor and tooling assessment"
      ],
      "primary": [
        "vendor-register-steward"
      ]
    },
    {
      "id": "retention-deletion-execution",
      "workflow_shape": "unclassified",
      "paths": [],
      "keywords": [
        "retention and deletion",
        "execute data deletion",
        "retention obligation"
      ],
      "primary": [
        "retention-and-deletion-executor"
      ]
    },
    {
      "id": "agent-performance-evaluation",
      "workflow_shape": "unclassified",
      "paths": [],
      "keywords": [
        "agent performance evaluation",
        "evaluate agent output",
        "agent feedback loop"
      ],
      "primary": [
        "agent-performance-evaluator"
      ]
    },
    {
      "id": "agent-version-provenance",
      "workflow_shape": "unclassified",
      "paths": [],
      "keywords": [
        "agent version control",
        "agent definition provenance",
        "which version of the agent"
      ],
      "primary": [
        "agent-version-control"
      ]
    },
    {
      "id": "ip-provenance-determination",
      "workflow_shape": "unclassified",
      "paths": [],
      "keywords": [
        "ip provenance",
        "intellectual property provenance",
        "ip determination"
      ],
      "primary": [
        "ip-provenance-agent"
      ]
    },
    {
      "id": "decision-record-capture",
      "workflow_shape": "unclassified",
      "paths": [],
      "keywords": [
        "decision record",
        "capture decision provenance",
        "record this decision"
      ],
      "primary": [
        "decision-record"
      ]
    },
    {
      "id": "governance-planning",
      "workflow_shape": "unclassified",
      "paths": [
        "governance/impact/**",
        "governance/accreditation/**"
      ],
      "keywords": [
        "governance impact",
        "data jurisdiction",
        "accreditation plan"
      ],
      "primary": [
        "governance-planner"
      ],
      "reviewers": [
        "compliance-reviewer"
      ],
      "support": [
        "evidence-curator"
      ],
      "quality_gates": [
        "G4",
        "G7"
      ]
    },
    {
      "id": "data-governance",
      "workflow_shape": "unclassified",
      "paths": [
        "governance/data/**",
        "data-governance/**",
        "platform/data/**"
      ],
      "keywords": [
        "non-egress",
        "derived output",
        "data residency",
        "data lineage requirements"
      ],
      "primary": [
        "data-governance-engineer"
      ],
      "reviewers": [
        "security-reviewer",
        "compliance-reviewer"
      ],
      "quality_gates": [
        "G4",
        "G5",
        "G7"
      ]
    },
    {
      "id": "cryptographic-assurance",
      "workflow_shape": "unclassified",
      "paths": [
        "security/crypto-assurance/**",
        "crypto-assurance/**",
        "platform/crypto/**"
      ],
      "keywords": [
        "crypto agility",
        "algorithm posture",
        "pqc",
        "qkms",
        "qkd",
        "qrng",
        "downgrade risk"
      ],
      "primary": [
        "cryptographic-assurance-engineer"
      ],
      "reviewers": [